All Social,All Social,All Social,All Social,All Social,All Social,All Social,All Social,All Social,All Social,All Social,Facebook,Instagram,LinkedIn,LinkedIn,Google (GBP),Google (GBP),Google (GBP),Google (GBP),Google (GBP),Google (GBP),Google (GBP),Google (GBP),Google (GBP),Google (GBP),YouTube,YouTube,YouTube,TikTok,TikTok,TikTok,TikTok,TikTok,TikTok,TikTok,Community,Community,Pinterest,Pinterest
postAtSpecificTime (YYYY-MM-DD HH:mm:ss),content,OGmetaUrl (url),imageUrls (comma-separated),gifUrl,videoUrls (comma-separated),mediaOptimization (true/false),applyWatermark (true/false),tags (comma-separated),category,followUpComment,type (post/story/reel),type (post/story/reel),pdfTitle,postAsPdf (true/false),eventType (call_to_action/event/offer),actionType (none/order/book/shop/learn_more/call/sign_up),title,offerTitle,startDate (YYYY-MM-DD HH:mm:ss),endDate (YYYY-MM-DD HH:mm:ss),termsConditions,couponCode,redeemOnlineUrl,actionUrl,title,privacyLevel (private/public/unlisted),type (video/short),privacyLevel (everyone/friends/only_me),promoteOtherBrand (true/false),enableComment (true/false),enableDuet (true/false),enableStitch (true/false),videoDisclosure (true/false),promoteYourBrand (true/false),title,notifyAllGroupMembers (true/false),title,link
2026-04-20 10:00:00,"Your laptop is a money printer.

Most people use it as a TV.

Same machine. Same 24 hours. Totally different output.

What did YOUR laptop do for you this week?

#Builders #NomadCEO #AI #Automation #Mindset #WaseemNasir #SkynetJoe #BuildInPublic #Entrepreneur #SideHustle",,https://raw.githubusercontent.com/waseemnasir2k26/ai-motivational-posts/main/batch5/images/waseem-batch5-01-tweet.png,,,TRUE,FALSE,"ai,motivation,quotes,builders,nomadceo",Motivation,Drop a 🖥️ if your laptop earned this week.,post,post,,FALSE,,,,,,,,,,,Your laptop is a money printer. Most people use it as a TV.,public,short,everyone,FALSE,TRUE,TRUE,TRUE,FALSE,FALSE,Your laptop is a money printer. Most people use it as a TV.,FALSE,Your laptop is a money printer. Most people use it as a TV.,https://www.waseemnasir.com
2026-04-21 14:00:00,"Waited for perfect conditions for 3 years.

They never came.

Shipped ugly. Fixed in prod. Got paid.

Perfect never ships. What are you waiting on that you could push TODAY?

#ShipIt #BuildInPublic #DevLife #AI #Automation #Founders #n8n #NomadCEO #WaseemNasir #SkynetJoe",,https://raw.githubusercontent.com/waseemnasir2k26/ai-motivational-posts/main/batch5/images/waseem-batch5-02-terminal.png,,,TRUE,FALSE,"ai,motivation,quotes,shipit,devlife",Motivation,What did you ship this week? Tag a builder who needs this reminder.,post,post,,FALSE,,,,,,,,,,,Excuses don't compile. Ship the bug. Fix in prod.,public,short,everyone,FALSE,TRUE,TRUE,TRUE,FALSE,FALSE,Excuses don't compile. Ship the bug. Fix in prod.,FALSE,Excuses don't compile. Ship the bug. Fix in prod.,https://www.waseemnasir.com
2026-04-22 11:00:00,"Watched 47 tutorials last month.
Built 0 things.

Sound familiar?

Consumption feels like progress. It's not.
Ship a messy v1 this weekend. Trust me.

What's the one thing you've been consuming instead of building?

#ShipIt #Builders #AI #Automation #BuildInPublic #Creators #Founders #n8n #WaseemNasir #SkynetJoe",,https://raw.githubusercontent.com/waseemnasir2k26/ai-motivational-posts/main/batch5/images/waseem-batch5-03-poster.png,,,TRUE,FALSE,"ai,motivation,builders,shipit,consumption",Motivation,Comment your v1 below. I'll review the first 10.,post,post,,FALSE,,,,,,,,,,,Stop consuming. Start shipping.,public,short,everyone,FALSE,TRUE,TRUE,TRUE,FALSE,FALSE,Stop consuming. Start shipping.,FALSE,Stop consuming. Start shipping.,https://www.waseemnasir.com
2026-04-23 09:00:00,"Sunday night you had a plan.
Monday 9am you opened Slack.

Suddenly the plan is gone.

The gap between the idea and the first real action — that's the graveyard. Close it fast.

What's the one idea you keep pushing to ""next Monday""?

#MondayMotivation #Builders #AI #Automation #Discipline #Founders #NomadCEO #ProductivityHacks #WaseemNasir #SkynetJoe",,https://raw.githubusercontent.com/waseemnasir2k26/ai-motivational-posts/main/batch5/images/waseem-batch5-04-serif.png,,,TRUE,FALSE,"ai,motivation,monday,discipline,founders",Motivation,Reply with your "next Monday" idea — I'll call you out if I see you dodging.,post,post,,FALSE,,,,,,,,,,,The gap between idea and Monday morning is where dreams die.,public,short,everyone,FALSE,TRUE,TRUE,TRUE,FALSE,FALSE,The gap between idea and Monday morning is where dreams die.,FALSE,The gap between idea and Monday morning is where dreams die.,https://www.waseemnasir.com
2026-04-24 17:00:00,"Bali last quarter. Istanbul this month. Dubai next.

Same laptop. Same clients. Same revenue.

Location stopped mattering the day my systems started running without me.

If you could work from anywhere — where would YOU be right now?

#NomadCEO #RemoteWork #DigitalNomad #Freedom #Automation #AI #BuildInPublic #Entrepreneurs #WaseemNasir #SkynetJoe",,https://raw.githubusercontent.com/waseemnasir2k26/ai-motivational-posts/main/batch5/images/waseem-batch5-05-xdark.png,,,TRUE,FALSE,"ai,motivation,nomadceo,remote,freedom",Motivation,Drop your dream WFH location in the comments.,post,post,,FALSE,,,,,,,,,,,Nomad CEO. 3 continents. One laptop. Zero excuses.,public,short,everyone,FALSE,TRUE,TRUE,TRUE,FALSE,FALSE,Nomad CEO. 3 continents. One laptop. Zero excuses.,FALSE,Nomad CEO. 3 continents. One laptop. Zero excuses.,https://www.waseemnasir.com
2026-04-25 12:00:00,"47 free tools shipped last year.

Viral? No.
Rich? Not yet.
Learned more than any course? Absolutely.

Reps > results — especially in year one.

What's your current ""rep count"" — tools built, posts written, calls taken?

#BuildInPublic #Builders #AI #Automation #Reps #Founders #SideProject #SkynetLabsToolkit #WaseemNasir #SkynetJoe",,https://raw.githubusercontent.com/waseemnasir2k26/ai-motivational-posts/main/batch5/images/waseem-batch5-06-stats.png,,,TRUE,FALSE,"ai,motivation,buildinpublic,reps,founders",Motivation,47 tools live at skynetlabs-toolkit.vercel.app — free forever.,post,post,,FALSE,,,,,,,,,,,47 tools built. 0 viral. Shipped anyway. Day 1 never ends.,public,short,everyone,FALSE,TRUE,TRUE,TRUE,FALSE,FALSE,47 tools built. 0 viral. Shipped anyway. Day 1 never ends.,FALSE,47 tools built. 0 viral. Shipped anyway. Day 1 never ends.,https://www.waseemnasir.com
